{
  "$schema": "https://json-schema.org/draft/2020-12/schema",
  "$id": "https://skymp.io/schemas/managed-backend-config.json",
  "type": "object",
  "required": ["internalApi", "database", "server", "supervisor", "sessions", "modules"],
  "properties": {
    "internalApi": { "$ref": "#/$defs/listener" },
    "database": {
      "type": "object", "required": ["adapter"],
      "properties": { "adapter": { "enum": ["sqlite", "postgres"] }, "path": { "type": "string" }, "connectionStringEnv": { "type": "string" } }
    },
    "server": {
      "type": "object",
      "required": ["internalTokenEnv", "name", "description", "region", "tags", "gamePort", "resourcesPort", "gamemode", "dataDirectory", "plugins", "loadOrder", "maxPlayers", "visibility"],
      "properties": {
        "id": { "type": "string" }, "internalTokenEnv": { "type": "string" }, "name": { "type": "string" },
        "description": { "type": "string" }, "region": { "type": "string" }, "tags": { "type": "array", "items": { "type": "string" } },
        "gamePort": { "type": "integer", "minimum": 1, "maximum": 65535 },
        "resourcesPort": { "type": "integer", "minimum": 1, "maximum": 65535 },
        "hostname": { "type": "string" }, "gamemode": { "type": "string", "minLength": 1 }, "dataDirectory": { "type": "string", "minLength": 1 },
        "plugins": { "type": "array", "items": { "type": "string" } },
        "loadOrder": { "type": "array", "items": { "type": "string", "minLength": 1 } },
        "modpack": {
          "type": "object", "required": ["nexusCollection", "revision"],
          "properties": {
            "nexusCollection": { "type": "string" }, "revision": { "type": "integer", "minimum": 1 },
            "hashes": { "type": "object", "additionalProperties": { "type": "string" } }
          }
        },
        "clientPack": {
          "type": "object",
          "additionalProperties": false,
          "required": ["archive", "host", "port"],
          "properties": {
            "archive": { "type": "string", "minLength": 1 },
            "host": { "type": "string", "minLength": 1 },
            "port": { "type": "integer", "minimum": 1, "maximum": 65535 }
          }
        },
        "maxPlayers": { "type": "integer", "minimum": 1 }, "visibility": { "enum": ["public", "private"] },
        "versions": { "type": "object", "additionalProperties": { "type": "string" } },
        "access": { "type": "object" }
      }
    },
    "supervisor": { "type": "object" },
    "sessions": { "type": "object", "required": ["ttlSeconds"], "properties": { "ttlSeconds": { "type": "integer", "minimum": 1 }, "directoryPublicKey": { "type": "string" }, "clockSkewMs": { "type": "integer", "minimum": 0 } } },
    "network": { "type": "object", "properties": { "autoMapPorts": { "type": "boolean" } } },
    "modules": { "type": "array", "items": { "$ref": "#/$defs/module" } }
  },
  "$defs": {
    "listener": { "type": "object", "required": ["host", "port"], "properties": { "host": { "type": "string" }, "port": { "type": "integer", "minimum": 1, "maximum": 65535 } } },
    "module": { "type": "object", "required": ["id", "enabled", "required"], "properties": { "id": { "type": "string" }, "enabled": { "type": "boolean" }, "required": { "type": "boolean" }, "path": { "type": "string" }, "config": { "type": "object" } } }
  }
}
